{
  "candidate_count": 52,
  "claim_boundary": "premeasurement_candidate_freeze_only_no_candidate_evaluation_or_retrieval_quality_claim",
  "conditional_reserve_candidate_count": 12,
  "evidence_class": "engineering_validation",
  "freeze_receipt_sha256": "ea93db368c3e740f7914e07e2bdfc15052991f6f05976f6924acdce717392e10",
  "generation_attempt_id": "a2freeze-20260812t014444z",
  "limit_reached": false,
  "lock_sha256": "c01f683b909e6f4c6310c01855b3f79319a183b7950f91338d43baa8a2d57952",
  "manifest_sha256": "f6276e3a15e760187152270418e00ce4cae4d8efe45b13edb02c4742e3b3049e",
  "matched_candidate_count": 40,
  "measured_a2_started": false,
  "model_name": "gpt-5.6-sol",
  "phase_id": "A2_PER_ARM_AUTOINDEX",
  "plan_type": "plus",
  "protected_data_accessed": false,
  "remaining_percent": 87,
  "resets_at_utc": "2026-08-18T00:45:40Z",
  "schema_version": "myis.armindex-a2-candidate-freeze-replay-validation.v1",
  "scientific_authority": false,
  "status": "PASS_A2_CANDIDATE_FREEZE_REPLAY",
  "task_id": "OFFICIAL_CODEX_BRIDGE_AND_CANDIDATE_FREEZE",
  "validated_from_revision": "481e60641d3155face8c1a5df997969f2be53689efb48aa0aa48ffca6e2dc4ec",
  "validation_id": "a2-five-arm-candidate-freeze-replay-v1",
  "validation_sha256": "6ba779d972b572eb84f0275f690a678c6db0de23b151c37d6bd64e5832ec9021"
}
